ISSN	Título	Estrato	Área de Avaliação	Status
1530-8669	Wireless Communications and Mobile Computing (Print)	B1	CIÊNCIA DA COMPUTAÇÃO	Atualizado
1386-145X	World Wide Web (Bussum)	B1	CIÊNCIA DA COMPUTAÇÃO	Atualizado
1076-6332	Academic Radiology	B2	CIÊNCIA DA COMPUTAÇÃO	Atualizado
1544-3558	ACM Transactions on Applied Perception (Print)	B2	CIÊNCIA DA COMPUTAÇÃO	Atualizado
1084-4309	ACM Transactions on Design Automation of Electronic Systems	B2	CIÊNCIA DA COMPUTAÇÃO	Atualizado
1936-7406	ACM Transactions on Reconfigurable Technology and Systems	B2	CIÊNCIA DA COMPUTAÇÃO	Atualizado
0094-5765	Acta Astronautica	B2	CIÊNCIA DA COMPUTAÇÃO	Atualizado
1610-1928	Acustica United with Acta Acustica	B2	CIÊNCIA DA COMPUTAÇÃO	Atualizado
1662-8985	Advanced Materials Research (Online)	B2	CIÊNCIA DA COMPUTAÇÃO	Atualizado
0219-5259	Advances in Complex Systems	B2	CIÊNCIA DA COMPUTAÇÃO	Atualizado
0001-8708	Advances in Mathematics (New York. 1965)	B2	CIÊNCIA DA COMPUTAÇÃO	Atualizado
0309-1708	Advances in Water Resources	B2	CIÊNCIA DA COMPUTAÇÃO	Atualizado
0001-1452	AIAA Journal (Print)	B2	CIÊNCIA DA COMPUTAÇÃO	Atualizado
0921-7126	AI Communications	B2	CIÊNCIA DA COMPUTAÇÃO	Atualizado
0002-9459	American Journal of Pharmaceutical Education	B2	CIÊNCIA DA COMPUTAÇÃO	Atualizado
1088-6826	American Mathematical Society. Proceedings	B2	CIÊNCIA DA COMPUTAÇÃO	Atualizado
0001-3765	Anais da Academia Brasileira de Ciências (Impresso)	B2	CIÊNCIA DA COMPUTAÇÃO	Atualizado
0884-6812	Analytical and Quantitative Cytology and Histology	B2	CIÊNCIA DA COMPUTAÇÃO	Atualizado
0306-4549	Annals of Nuclear Energy	B2	CIÊNCIA DA COMPUTAÇÃO	Atualizado
0090-5364	Annals of Statistics	B2	CIÊNCIA DA COMPUTAÇÃO	Atualizado
1367-5788	Annual Reviews in Control	B2	CIÊNCIA DA COMPUTAÇÃO	Atualizado
0195-6663	Appetite (London. Print)	B2	CIÊNCIA DA COMPUTAÇÃO	Atualizado
1432-0622	Applicable algebra in engineering, communication and computing (Internet)	B2	CIÊNCIA DA COMPUTAÇÃO	Atualizado
1452-8630	Applicable Analysis and Discrete Mathematics	B2	CIÊNCIA DA COMPUTAÇÃO	Atualizado
0099-2240	Applied and Environmental Microbiology (Print)	B2	CIÊNCIA DA COMPUTAÇÃO	Atualizado
0003-6870	Applied Ergonomics	B2	CIÊNCIA DA COMPUTAÇÃO	Atualizado
1570-5838	Applied Ontology	B2	CIÊNCIA DA COMPUTAÇÃO	Atualizado
1359-4311	Applied Thermal Engineering	B2	CIÊNCIA DA COMPUTAÇÃO	Atualizado
1420-8938	Archiv der Mathematik (Electronic ed.)	B2	CIÊNCIA DA COMPUTAÇÃO	Atualizado
0003-889X	Archiv der Mathematik (Printed ed.)	B2	CIÊNCIA DA COMPUTAÇÃO	Atualizado
0003-9861	Archives of Biochemistry and Biophysics (Print)	B2	CIÊNCIA DA COMPUTAÇÃO	Atualizado
0003-9985	Archives of Pathology & Laboratory Medicine (1976)	B2	CIÊNCIA DA COMPUTAÇÃO	Atualizado
0381-7032	Ars Combinatoria	B2	CIÊNCIA DA COMPUTAÇÃO	Atualizado
0928-8910	Automated Software Engineering	B2	CIÊNCIA DA COMPUTAÇÃO	Atualizado
1931-6690	Bayesian analysis (Online)	B2	CIÊNCIA DA COMPUTAÇÃO	Atualizado
0304-4165	Biochimica et Biophysica Acta. G, General Subjects (Print)	B2	CIÊNCIA DA COMPUTAÇÃO	Atualizado
1559-4106	BIOINTERPHASES	B2	CIÊNCIA DA COMPUTAÇÃO	Atualizado
1475-925X	Biomedical Engineering Online (Online)	B2	CIÊNCIA DA COMPUTAÇÃO	Atualizado
0323-3847	Biometrical Journal (1977)	B2	CIÊNCIA DA COMPUTAÇÃO	Atualizado
1615-7591	Bioprocess and Biosystems Engineering (Print)	B2	CIÊNCIA DA COMPUTAÇÃO	Atualizado
1471-2156	BMC Genetics (Online)	B2	CIÊNCIA DA COMPUTAÇÃO	Atualizado
1471-2180	BMC Microbiology (Online)	B2	CIÊNCIA DA COMPUTAÇÃO	Atualizado
1471-2229	BMC Plant Biology (Online)	B2	CIÊNCIA DA COMPUTAÇÃO	Atualizado
1752-0509	BMC Systems Biology	B2	CIÊNCIA DA COMPUTAÇÃO	Atualizado
0100-879X	Brazilian Journal of Medical and Biological Research (Impresso)	B2	CIÊNCIA DA COMPUTAÇÃO	Atualizado
0103-9733	Brazilian Journal of Physics (Impresso)	B2	CIÊNCIA DA COMPUTAÇÃO	Atualizado
1867-0202	Business & Information Systems Engineering	B2	CIÊNCIA DA COMPUTAÇÃO	Atualizado
1574-0153	Cancer Biomarkers: section of Disease Markers	B2	CIÊNCIA DA COMPUTAÇÃO	Atualizado
0008-6568	Caries Research	B2	CIÊNCIA DA COMPUTAÇÃO	Atualizado
1389-9333	Cell and Tissue Banking	B2	CIÊNCIA DA COMPUTAÇÃO	Atualizado
2211-3428	Cellular Oncology	B2	CIÊNCIA DA COMPUTAÇÃO	Atualizado
1054-1500	Chaos (Woodbury, N.Y.)	B2	CIÊNCIA DA COMPUTAÇÃO	Atualizado
1089-7682	Chaos (Woodbury, N.Y. Online)	B2	CIÊNCIA DA COMPUTAÇÃO	Atualizado
1747-0277	Chemical Biology & Drug Design (Print)	B2	CIÊNCIA DA COMPUTAÇÃO	Atualizado
0169-7439	Chemometrics and Intelligent Laboratory Systems (Print)	B2	CIÊNCIA DA COMPUTAÇÃO	Atualizado
1386-7857	Cluster Computing	B2	CIÊNCIA DA COMPUTAÇÃO	Atualizado
1092-8529	CNS Spectrums	B2	CIÊNCIA DA COMPUTAÇÃO	Atualizado
0378-3839	Coastal Engineering	B2	CIÊNCIA DA COMPUTAÇÃO	Atualizado
1007-5704	Communications in Nonlinear Science & Numerical Simulation	B2	CIÊNCIA DA COMPUTAÇÃO	Atualizado
1532-415X	Communications in Statistics, Theory and Methods (Online)	B2	CIÊNCIA DA COMPUTAÇÃO	Atualizado
1420-8954	Computational Complexity (Electronic ed.)	B2	CIÊNCIA DA COMPUTAÇÃO	Atualizado
1619-697X	Computational Management Science (Print)	B2	CIÊNCIA DA COMPUTAÇÃO	Atualizado
0943-4062	Computational Statistics (Zeitschrift)	B2	CIÊNCIA DA COMPUTAÇÃO	Atualizado
1613-9658	Computational Statistics (Zeitschrift. Internet)	B2	CIÊNCIA DA COMPUTAÇÃO	Atualizado
1531-5169	Computer Music Journal (Online)	B2	CIÊNCIA DA COMPUTAÇÃO	Atualizado
0045-7906	Computers & Electrical Engineering	B2	CIÊNCIA DA COMPUTAÇÃO	Atualizado
0950-0618	Construction & Building Materials	B2	CIÊNCIA DA COMPUTAÇÃO	Atualizado
0929-8673	Current Medicinal Chemistry	B2	CIÊNCIA DA COMPUTAÇÃO	Atualizado
1389-2037	Current Protein and Peptide Science	B2	CIÊNCIA DA COMPUTAÇÃO	Atualizado
1087-6553	Cybernetics And Systems (Online)	B2	CIÊNCIA DA COMPUTAÇÃO	Atualizado
1600-4469	Dental Traumatology (Print)	B2	CIÊNCIA DA COMPUTAÇÃO	Atualizado
0929-5585	Design Automation for Embedded Systems	B2	CIÊNCIA DA COMPUTAÇÃO	Atualizado
1572-8080	Design Automation For Embedded Systems (Dordrecht. Online)	B2	CIÊNCIA DA COMPUTAÇÃO	Atualizado
0012-1606	Developmental Biology (Print)	B2	CIÊNCIA DA COMPUTAÇÃO	Atualizado
1058-8388	Developmental Dynamics	B2	CIÊNCIA DA COMPUTAÇÃO	Atualizado
1365-8050	Discrete Mathematics and Theoretical Computer Science (Online)	B2	CIÊNCIA DA COMPUTAÇÃO	Atualizado
0304-3800	Ecological Modelling	B2	CIÊNCIA DA COMPUTAÇÃO	Atualizado
0378-7796	Electric Power Systems Research (Print)	B2	CIÊNCIA DA COMPUTAÇÃO	Atualizado
0301-150X	Electromyography and Clinical Neurophysiology	B2	CIÊNCIA DA COMPUTAÇÃO	Atualizado
1863-2122	Electronic Communications of the EASST	B2	CIÊNCIA DA COMPUTAÇÃO	Atualizado
0717-3458	Electronic Journal of Biotechnology	B2	CIÊNCIA DA COMPUTAÇÃO	Atualizado
1072-6691	Electronic Journal of Differential Equations	B2	CIÊNCIA DA COMPUTAÇÃO	Atualizado
1479-439X	Electronic Journal of e-Government	B2	CIÊNCIA DA COMPUTAÇÃO	Atualizado
0305-215X	Engineering Optimization (Print)	B2	CIÊNCIA DA COMPUTAÇÃO	Atualizado
1751-7575	Enterprise Information Systems (Print)	B2	CIÊNCIA DA COMPUTAÇÃO	Atualizado
1352-8505	Environmental and Ecological Statistics	B2	CIÊNCIA DA COMPUTAÇÃO	Atualizado
0167-6369	Environmental Monitoring and Assessment (Print)	B2	CIÊNCIA DA COMPUTAÇÃO	Atualizado
0263-7758	Environment and Planning. D, Society & Space (Print)	B2	CIÊNCIA DA COMPUTAÇÃO	Atualizado
1180-4009	EnvironMetrics (London. Ont.)	B2	CIÊNCIA DA COMPUTAÇÃO	Atualizado
1292-8119	ESAIM Control Optimization and Calculus Variations	B2	CIÊNCIA DA COMPUTAÇÃO	Atualizado
0947-3580	European Journal of Control	B2	CIÊNCIA DA COMPUTAÇÃO	Atualizado
0223-5234	European Journal of Medicinal Chemistry	B2	CIÊNCIA DA COMPUTAÇÃO	Atualizado
1434-6036	European Physical Journal. B, Condensed Matter and Complex Systems (Internet)	B2	CIÊNCIA DA COMPUTAÇÃO	Atualizado
0295-5075	Europhysics Letters (Print)	B2	CIÊNCIA DA COMPUTAÇÃO	Atualizado
1058-6458	Experimental Mathematics	B2	CIÊNCIA DA COMPUTAÇÃO	Atualizado
1468-0394	Expert Systems (Online)	B2	CIÊNCIA DA COMPUTAÇÃO	Atualizado
0266-4720	Expert Systems (Print)	B2	CIÊNCIA DA COMPUTAÇÃO	Atualizado
1396-0466	First Monday (Online)	B2	CIÊNCIA DA COMPUTAÇÃO	Atualizado
0963-9969	Food Research International	B2	CIÊNCIA DA COMPUTAÇÃO	Atualizado
0379-0738	Forensic Science International	B2	CIÊNCIA DA COMPUTAÇÃO	Atualizado
1615-3383	Foundations of Computational Mathematics (Internet)	B2	CIÊNCIA DA COMPUTAÇÃO	Atualizado
0378-3820	Fuel Processing Technology	B2	CIÊNCIA DA COMPUTAÇÃO	Atualizado
0378-1119	Gene (Amsterdam)	B2	CIÊNCIA DA COMPUTAÇÃO	Atualizado
1676-5680	Genetics and Molecular Research	B2	CIÊNCIA DA COMPUTAÇÃO	Atualizado
0016-7061	Geoderma (Amsterdam)	B2	CIÊNCIA DA COMPUTAÇÃO	Atualizado
1524-0703	Graphical Models (Print)	B2	CIÊNCIA DA COMPUTAÇÃO	Atualizado
0911-0119	Graphs and Combinatorics	B2	CIÊNCIA DA COMPUTAÇÃO	Atualizado
0926-2644	Group Decision and Negotiation	B2	CIÊNCIA DA COMPUTAÇÃO	Atualizado
0017-8012	Harvard Business Review	B2	CIÊNCIA DA COMPUTAÇÃO	Atualizado
1050-9631	Hippocampus (New York, N.Y. Print)	B2	CIÊNCIA DA COMPUTAÇÃO	Atualizado
1078-9669	HVAC & R Research	B2	CIÊNCIA DA COMPUTAÇÃO	Atualizado
0885-6087	Hydrological Processes (Print)	B2	CIÊNCIA DA COMPUTAÇÃO	Atualizado
1083-4435	IEEE/ASME Transactions on Mechatronics	B2	CIÊNCIA DA COMPUTAÇÃO	Atualizado
0739-5175	IEEE Engineering in Medicine and Biology Magazine	B2	CIÊNCIA DA COMPUTAÇÃO	Atualizado
1070-9878	IEEE Transactions on Dielectrics and Electrical Insulation	B2	CIÊNCIA DA COMPUTAÇÃO	Atualizado
0018-9464	IEEE Transactions on Magnetics	B2	CIÊNCIA DA COMPUTAÇÃO	Atualizado
0018-9499	IEEE Transactions on Nuclear Science	B2	CIÊNCIA DA COMPUTAÇÃO	Atualizado
0885-8977	IEEE Transactions on Power Delivery	B2	CIÊNCIA DA COMPUTAÇÃO	Atualizado
1751-8660	IET Electric Power Applications (Print)	B2	CIÊNCIA DA COMPUTAÇÃO	Atualizado
1751-8687	IET Generation, Transmission & Distribution (Print)	B2	CIÊNCIA DA COMPUTAÇÃO	Atualizado
1826-9885	Il Nuovo Cimento della Società Italiana di Fisica. C. Geophysics and Space Physics (Online)	B2	CIÊNCIA DA COMPUTAÇÃO	Atualizado
1567-1348	Infection, Genetics and Evolution (Print)	B2	CIÊNCIA DA COMPUTAÇÃO	Atualizado
0315-5986	INFOR. Information Systems and Operational Research	B2	CIÊNCIA DA COMPUTAÇÃO	Atualizado
1369-118X	Information, Communication & Society	B2	CIÊNCIA DA COMPUTAÇÃO	Atualizado
0968-5227	Information Management & Computer Security	B2	CIÊNCIA DA COMPUTAÇÃO	Atualizado
1570-1255	Information Polity	B2	CIÊNCIA DA COMPUTAÇÃO	Atualizado
0730-9295	Information Technology and Libraries	B2	CIÊNCIA DA COMPUTAÇÃO	Atualizado
0988-3754	Informatique Théorique et Applications (Imprimé)	B2	CIÊNCIA DA COMPUTAÇÃO	Atualizado
1872-7522	Integration (Amsterdam. Online)	B2	CIÊNCIA DA COMPUTAÇÃO	Atualizado
0167-9260	Integration (Amsterdam. Print)	B2	CIÊNCIA DA COMPUTAÇÃO	Atualizado
1072-5520	Interactions (New York, N.Y.)	B2	CIÊNCIA DA COMPUTAÇÃO	Atualizado
0092-2102	Interfaces (Providence)	B2	CIÊNCIA DA COMPUTAÇÃO	Atualizado
0964-8305	International Biodeterioration & Biodegradation	B2	CIÊNCIA DA COMPUTAÇÃO	Atualizado
0268-3768	International Journal, Advanced Manufacturing Technology	B2	CIÊNCIA DA COMPUTAÇÃO	Atualizado
0020-7519	International Journal for Parasitology	B2	CIÊNCIA DA COMPUTAÇÃO	Atualizado
1353-4505	International Journal for Quality in Health Care	B2	CIÊNCIA DA COMPUTAÇÃO	Atualizado
0218-1967	International Journal of Algebra and Computation	B2	CIÊNCIA DA COMPUTAÇÃO	Atualizado
1641-876X	International Journal of Applied Mathematics and Computer Science	B2	CIÊNCIA DA COMPUTAÇÃO	Atualizado
0218-1274	International Journal of Bifurcation and Chaos in Applied Sciences and Engineering	B2	CIÊNCIA DA COMPUTAÇÃO	Atualizado
1758-0374	International Journal of Bio-Inspired Computation (Online)	B2	CIÊNCIA DA COMPUTAÇÃO	Atualizado
1758-0366	International Journal of Bio-Inspired Computation (Print)	B2	CIÊNCIA DA COMPUTAÇÃO	Atualizado
1061-8562	International Journal of Computational Fluid Dynamics (Print)	B2	CIÊNCIA DA COMPUTAÇÃO	Atualizado
1861-6410	International Journal of Computer Assisted Radiology and Surgery (Print)	B2	CIÊNCIA DA COMPUTAÇÃO	Atualizado
0020-7160	International Journal of Computer Mathematics	B2	CIÊNCIA DA COMPUTAÇÃO	Atualizado
1748-5673	International Journal of Data Mining and Bioinformatics	B2	CIÊNCIA DA COMPUTAÇÃO	Atualizado
0142-0615	International Journal of Electrical Power & Energy Systems	B2	CIÊNCIA DA COMPUTAÇÃO	Atualizado
0020-7225	International Journal of Engineering Science	B2	CIÊNCIA DA COMPUTAÇÃO	Atualizado
0169-2070	International Journal of Forecasting	B2	CIÊNCIA DA COMPUTAÇÃO	Atualizado
0129-0541	International Journal of Foundations of Computer Science	B2	CIÊNCIA DA COMPUTAÇÃO	Atualizado
1476-072X	International Journal of Health Geographics	B2	CIÊNCIA DA COMPUTAÇÃO	Atualizado
1751-6528	International Journal of High Performance Systems Architecture (Print)	B2	CIÊNCIA DA COMPUTAÇÃO	Atualizado
0219-4678	International Journal of Image and Graphics	B2	CIÊNCIA DA COMPUTAÇÃO	Atualizado
0899-9457	International Journal of Imaging Systems and Technology (Print)	B2	CIÊNCIA DA COMPUTAÇÃO	Atualizado
0169-8141	International Journal of Industrial Ergonomics	B2	CIÊNCIA DA COMPUTAÇÃO	Atualizado
0219-6220	INTERNATIONAL JOURNAL OF INFORMATION TECHNOLOGY & DECISION MAKING	B2	CIÊNCIA DA COMPUTAÇÃO	Atualizado
0218-2157	International Journal of Intelligent and Cooperative Information Systems	B2	CIÊNCIA DA COMPUTAÇÃO	Atualizado
1741-1009	International Journal of Knowledge and Learning (Print)	B2	CIÊNCIA DA COMPUTAÇÃO	Atualizado
0217-9792	International Journal of Modern Physics B	B2	CIÊNCIA DA COMPUTAÇÃO	Atualizado
0129-1831	International Journal of Modern Physics C	B2	CIÊNCIA DA COMPUTAÇÃO	Atualizado
1744-5760	International Journal of Parallel, Emergent and Distributed Systems (Print)	B2	CIÊNCIA DA COMPUTAÇÃO	Atualizado
0885-7458	International Journal of Parallel Programming	B2	CIÊNCIA DA COMPUTAÇÃO	Atualizado
0925-5273	International Journal of Production Economics	B2	CIÊNCIA DA COMPUTAÇÃO	Atualizado
0219-7499	International Journal of Quantum Information	B2	CIÊNCIA DA COMPUTAÇÃO	Atualizado
1747-8405	International Journal of Security and Networks (Print)	B2	CIÊNCIA DA COMPUTAÇÃO	Atualizado
0218-1940	International Journal of Software Engineering and Knowledge Engineering	B2	CIÊNCIA DA COMPUTAÇÃO	Atualizado
1476-1289	International Journal of Web Engineering and Technology	B2	CIÊNCIA DA COMPUTAÇÃO	Atualizado
1068-9605	International Journal of Wireless Information Networks	B2	CIÊNCIA DA COMPUTAÇÃO	Atualizado
1433-2787	International Journal on Software Tools for Technology Transfer (Internet)	B2	CIÊNCIA DA COMPUTAÇÃO	Atualizado
1433-2779	International Journal on Software Tools for Technology Transfer (Print)	B2	CIÊNCIA DA COMPUTAÇÃO	Atualizado
0021-2172	Israel Journal of Mathematics	B2	CIÊNCIA DA COMPUTAÇÃO	Atualizado
1520-9202	IT Professional	B2	CIÊNCIA DA COMPUTAÇÃO	Atualizado
1460-7425	JASSS (Guildford)	B2	CIÊNCIA DA COMPUTAÇÃO	Atualizado
0021-8561	Journal of Agricultural and Food Chemistry	B2	CIÊNCIA DA COMPUTAÇÃO	Atualizado
0969-6997	Journal of Air Transport Management	B2	CIÊNCIA DA COMPUTAÇÃO	Atualizado
0021-8936	Journal of Applied Mechanics	B2	CIÊNCIA DA COMPUTAÇÃO	Atualizado
1558-8424	Journal of Applied Meteorology and Climatology	B2	CIÊNCIA DA COMPUTAÇÃO	Atualizado
1166-3081	Journal of Applied Non-Classical Logics	B2	CIÊNCIA DA COMPUTAÇÃO	Atualizado
0021-8979	Journal of Applied Physics	B2	CIÊNCIA DA COMPUTAÇÃO	Atualizado
0739-0572	Journal of Atmospheric and Oceanic Technology	B2	CIÊNCIA DA COMPUTAÇÃO	Atualizado
0021-9193	Journal of Bacteriology (Print)	B2	CIÊNCIA DA COMPUTAÇÃO	Atualizado
1097-6647	Journal of Cardiovascular Magnetic Resonance	B2	CIÊNCIA DA COMPUTAÇÃO	Atualizado
1532-429X	Journal of Cardiovascular Magnetic Resonance	B2	CIÊNCIA DA COMPUTAÇÃO	Atualizado
0886-9383	Journal of Chemometrics (Print)	B2	CIÊNCIA DA COMPUTAÇÃO	Atualizado
0218-1266	Journal of Circuits, Systems, and Computers	B2	CIÊNCIA DA COMPUTAÇÃO	Atualizado
0959-6526	Journal of Cleaner Production	B2	CIÊNCIA DA COMPUTAÇÃO	Atualizado
1229-2370	Journal of Communications and Networks (Seoul. Print)	B2	CIÊNCIA DA COMPUTAÇÃO	Atualizado
0021-9983	Journal of Composite Materials	B2	CIÊNCIA DA COMPUTAÇÃO	Atualizado
1000-9000	Journal of Computer Science and Technology	B2	CIÊNCIA DA COMPUTAÇÃO	Atualizado
1666-6038	Journal of Computer Science and Technology (La Plata. En línea)	B2	CIÊNCIA DA COMPUTAÇÃO	Atualizado
1530-9827	Journal of Computing and Information Science in Engineering	B2	CIÊNCIA DA COMPUTAÇÃO	Atualizado
1296-2074	Journal of Cultural Heritage	B2	CIÊNCIA DA COMPUTAÇÃO	Atualizado
0022-0302	Journal of Dairy Science	B2	CIÊNCIA DA COMPUTAÇÃO	Atualizado
1533-8010	Journal of Database Management (Online)	B2	CIÊNCIA DA COMPUTAÇÃO	Atualizado
0374-3535	Journal of Elasticity	B2	CIÊNCIA DA COMPUTAÇÃO	Atualizado
0923-8174	Journal of Electronic Testing	B2	CIÊNCIA DA COMPUTAÇÃO	Atualizado
1573-0727	Journal of Electronic Testing (Dordrecht. Online)	B2	CIÊNCIA DA COMPUTAÇÃO	Atualizado
1362-3079	Journal of Experimental and Theoretical Artificial Intelligence (Online)	B2	CIÊNCIA DA COMPUTAÇÃO	Atualizado
0952-813X	Journal of Experimental and Theoretical Artificial Intelligence (Print)	B2	CIÊNCIA DA COMPUTAÇÃO	Atualizado
1098-612X	Journal of Feline Medicine and Surgery	B2	CIÊNCIA DA COMPUTAÇÃO	Atualizado
0022-1503	Journal of Heredity	B2	CIÊNCIA DA COMPUTAÇÃO	Atualizado
1016-2364	Journal of Information Science and Engineering	B2	CIÊNCIA DA COMPUTAÇÃO	Atualizado
1751-1577	Journal of Informatrics	B2	CIÊNCIA DA COMPUTAÇÃO	Atualizado
1064-1246	Journal of Intelligent & Fuzzy Systems	B2	CIÊNCIA DA COMPUTAÇÃO	Atualizado
1547-2450	Journal of Intelligent Transportation Systems	B2	CIÊNCIA DA COMPUTAÇÃO	Atualizado
0925-8531	Journal of Logic, Language and Information	B2	CIÊNCIA DA COMPUTAÇÃO	Atualizado
0950-4230	Journal of Loss Prevention in the Process Industries	B2	CIÊNCIA DA COMPUTAÇÃO	Atualizado
1546-1998	Journal of Low Power Electronics (Print)	B2	CIÊNCIA DA COMPUTAÇÃO	Atualizado
1059-9495	Journal of Materials Engineering and Performance (Print)	B2	CIÊNCIA DA COMPUTAÇÃO	Atualizado
0924-0136	Journal of Materials Processing Technology	B2	CIÊNCIA DA COMPUTAÇÃO	Atualizado
1096-0813	Journal of Mathematical Analysis and Applications (Online)	B2	CIÊNCIA DA COMPUTAÇÃO	Atualizado
0022-247X	Journal of Mathematical Analysis and Applications (Print)	B2	CIÊNCIA DA COMPUTAÇÃO	Atualizado
0303-6812	Journal of Mathematical Biology (Print)	B2	CIÊNCIA DA COMPUTAÇÃO	Atualizado
0022-2488	Journal of Mathematical Physics	B2	CIÊNCIA DA COMPUTAÇÃO	Atualizado
0146-6615	Journal of Medical Virology (Print)	B2	CIÊNCIA DA COMPUTAÇÃO	Atualizado
0948-5023	Journal of Molecular Modeling (Online)	B2	CIÊNCIA DA COMPUTAÇÃO	Atualizado
1610-2940	Journal of Molecular Modeling (Print)	B2	CIÊNCIA DA COMPUTAÇÃO	Atualizado
0047-259X	Journal of Multivariate Analysis	B2	CIÊNCIA DA COMPUTAÇÃO	Atualizado
1095-7243	Journal of Multivariate Analysis (Online)	B2	CIÊNCIA DA COMPUTAÇÃO	Atualizado
0165-0270	Journal of Neuroscience Methods	B2	CIÊNCIA DA COMPUTAÇÃO	Atualizado
0377-0257	Journal of Non-Newtonian Fluid Mechanics (Print)	B2	CIÊNCIA DA COMPUTAÇÃO	Atualizado
0022-3131	Journal of Nuclear Science and Technology	B2	CIÊNCIA DA COMPUTAÇÃO	Atualizado
1660-1769	Journal of Object Technology	B2	CIÊNCIA DA COMPUTAÇÃO	Atualizado
1532-7744	Journal of Organizational Computing and Electronic Commerce (Online)	B2	CIÊNCIA DA COMPUTAÇÃO	Atualizado
0920-4105	Journal of Petroleum Science & Engineering	B2	CIÊNCIA DA COMPUTAÇÃO	Atualizado
1751-8113	Journal of Physics. A, Mathematical and Theoretical (Print)	B2	CIÊNCIA DA COMPUTAÇÃO	Atualizado
1742-6596	Journal of Physics. Conference Series (Online)	B2	CIÊNCIA DA COMPUTAÇÃO	Atualizado
1535-3907	Journal of Proteome Research (Online)	B2	CIÊNCIA DA COMPUTAÇÃO	Atualizado
1535-3893	Journal of Proteome Research (Print)	B2	CIÊNCIA DA COMPUTAÇÃO	Atualizado
1874-3919	Journal of Proteomics (Print)	B2	CIÊNCIA DA COMPUTAÇÃO	Atualizado
0022-4049	Journal of Pure and Applied Algebra (Print)	B2	CIÊNCIA DA COMPUTAÇÃO	Atualizado
0022-4065	Journal of Quality Technology	B2	CIÊNCIA DA COMPUTAÇÃO	Atualizado
1532-0618	Journal of Software Maintenance and Evolution	B2	CIÊNCIA DA COMPUTAÇÃO	Atualizado
1532-060X	Journal of Software Maintenance and Evolution (Print)	B2	CIÊNCIA DA COMPUTAÇÃO	Atualizado
0928-0707	Journal of Sol-Gel Science and Technology	B2	CIÊNCIA DA COMPUTAÇÃO	Atualizado
1742-5468	Journal of Statistical Mechanics	B2	CIÊNCIA DA COMPUTAÇÃO	Atualizado
0378-3758	Journal of Statistical Planning and Inference (Print)	B2	CIÊNCIA DA COMPUTAÇÃO	Atualizado
1933-1711	Journal of the American Society of Hypertension	B2	CIÊNCIA DA COMPUTAÇÃO	Atualizado
0104-6500	Journal of the Brazilian Computer Society (Impresso)	B2	CIÊNCIA DA COMPUTAÇÃO	Atualizado
1678-4804	Journal of The Brazilian Computer Society (Online)	B2	CIÊNCIA DA COMPUTAÇÃO	Atualizado
0016-0032	Journal of the Franklin Institute	B2	CIÊNCIA DA COMPUTAÇÃO	Atualizado
0022-5193	Journal of Theoretical Biology	B2	CIÊNCIA DA COMPUTAÇÃO	Atualizado
1383-469X	Journal on Special Topics in Mobile Networks and Applications	B2	CIÊNCIA DA COMPUTAÇÃO	Atualizado
1226-119X	Korea-Australia Rheology Journal	B2	CIÊNCIA DA COMPUTAÇÃO	Atualizado
0368-492X	Kybernetes	B2	CIÊNCIA DA COMPUTAÇÃO	Atualizado
0743-7463	Langmuir	B2	CIÊNCIA DA COMPUTAÇÃO	Atualizado
1054-660X	Laser Physics	B2	CIÊNCIA DA COMPUTAÇÃO	Atualizado
0024-3795	Linear Algebra and its Applications	B2	CIÊNCIA DA COMPUTAÇÃO	Atualizado
0025-1909	Management Science	B2	CIÊNCIA DA COMPUTAÇÃO	Atualizado
1432-2994	Mathematical Methods of Operations Research (Heidelberg)	B2	CIÊNCIA DA COMPUTAÇÃO	Atualizado
1469-8072	Mathematical Structures in Computer Science	B2	CIÊNCIA DA COMPUTAÇÃO	Atualizado
2150-7511	mBio (Online)	B2	CIÊNCIA DA COMPUTAÇÃO	Atualizado
1350-4533	Medical Engineering & Physics	B2	CIÊNCIA DA COMPUTAÇÃO	Atualizado
0074-0276	Memórias do Instituto Oswaldo Cruz (Impresso)	B2	CIÊNCIA DA COMPUTAÇÃO	Atualizado
0141-9331	Microprocessors and Microsystems	B2	CIÊNCIA DA COMPUTAÇÃO	Atualizado
0166-6851	Molecular and Biochemical Parasitology (Print)	B2	CIÊNCIA DA COMPUTAÇÃO	Atualizado
0301-4851	Molecular Biology Reports	B2	CIÊNCIA DA COMPUTAÇÃO	Atualizado
0923-6082	Multidimensional Systems and Signal Processing	B2	CIÊNCIA DA COMPUTAÇÃO	Atualizado
1573-0824	Multidimensional Systems and Signal Processing (Online)	B2	CIÊNCIA DA COMPUTAÇÃO	Atualizado
1380-7501	Multimedia Tools and Applications	B2	CIÊNCIA DA COMPUTAÇÃO	Atualizado
1433-3058	Neural Computing & Applications (Internet)	B2	CIÊNCIA DA COMPUTAÇÃO	Atualizado
0941-0643	Neural Computing & Applications (Print)	B2	CIÊNCIA DA COMPUTAÇÃO	Atualizado
0148-396X	Neurosurgery	B2	CIÊNCIA DA COMPUTAÇÃO	Atualizado
0288-3635	New Generation Computing	B2	CIÊNCIA DA COMPUTAÇÃO	Atualizado
0362-546X	Nonlinear Analysis	B2	CIÊNCIA DA COMPUTAÇÃO	Atualizado
0168-9002	Nuclear Instruments & Methods in Physics Research. Section A, Accelerators, Spectrometers, Detectors and Associated Equipment (Print)	B2	CIÊNCIA DA COMPUTAÇÃO	Atualizado
0168-583X	Nuclear Instruments & Methods in Physics Research. Section B, Beam Interactions with Materials and Atoms (Print)	B2	CIÊNCIA DA COMPUTAÇÃO	Atualizado
0964-5691	Ocean & Coastal Management	B2	CIÊNCIA DA COMPUTAÇÃO	Atualizado
1536-2310	OMICS: Journal of Integrative Biology	B2	CIÊNCIA DA COMPUTAÇÃO	Atualizado
1468-4535	Online Information Review	B2	CIÊNCIA DA COMPUTAÇÃO	Atualizado
0091-3286	Optical Engineering (Bellingham. Print)	B2	CIÊNCIA DA COMPUTAÇÃO	Atualizado
1029-4945	Optimization (Online)	B2	CIÊNCIA DA COMPUTAÇÃO	Atualizado
0233-1934	Optimization (Print)	B2	CIÊNCIA DA COMPUTAÇÃO	Atualizado
0129-6264	Parallel Processing Letters	B2	CIÊNCIA DA COMPUTAÇÃO	Atualizado
0102-5473	Perspectiva (UFSC)	B2	CIÊNCIA DA COMPUTAÇÃO	Atualizado
1364-503X	Philosophical Transactions - Royal Society. Mathematical, Physical and Engineering Sciences (Print)	B2	CIÊNCIA DA COMPUTAÇÃO	Atualizado
1549-5418	Photomedicine and Laser Surgery	B2	CIÊNCIA DA COMPUTAÇÃO	Atualizado
1387-974X	Photonic Network Communications	B2	CIÊNCIA DA COMPUTAÇÃO	Atualizado
0378-4371	Physica. A (Print)	B2	CIÊNCIA DA COMPUTAÇÃO	Atualizado
0921-4526	Physica. B, Condensed Matter (Print)	B2	CIÊNCIA DA COMPUTAÇÃO	Atualizado
0167-2789	Physica. D, Nonlinear Phenomena (Print)	B2	CIÊNCIA DA COMPUTAÇÃO	Atualizado
1050-2947	Physical Review. A	B2	CIÊNCIA DA COMPUTAÇÃO	Atualizado
1070-664X	Physics of Plasmas	B2	CIÊNCIA DA COMPUTAÇÃO	Atualizado
0967-3334	Physiological Measurement (Print)	B2	CIÊNCIA DA COMPUTAÇÃO	Atualizado
0031-949X	Phytopathology	B2	CIÊNCIA DA COMPUTAÇÃO	Atualizado
0304-4289	Pramana (Bangalore)	B2	CIÊNCIA DA COMPUTAÇÃO	Atualizado
1531-3263	Presence	B2	CIÊNCIA DA COMPUTAÇÃO	Atualizado
1054-7460	Presence (Cambridge, Mass.)	B2	CIÊNCIA DA COMPUTAÇÃO	Atualizado
0002-9939	Proceedings of the American Mathematical Society	B2	CIÊNCIA DA COMPUTAÇÃO	Atualizado
0959-6518	Proceedings of the Institution of Mechanical Engineers. Part I, Journal of Systems and Control Engineering	B2	CIÊNCIA DA COMPUTAÇÃO	Atualizado
0024-6115	Proceedings of the London Mathematical Society (Print)	B2	CIÊNCIA DA COMPUTAÇÃO	Atualizado
