ISSN	Título	Estrato	Área de Avaliação	Status
0038-0644	Software, Practice & Experience (Print)	A2	CIÊNCIA DA COMPUTAÇÃO	Atualizado
0167-6393	Speech Communication (Print)	A2	CIÊNCIA DA COMPUTAÇÃO	Atualizado
1615-1488	Structural and Multidisciplinary Optimization (Internet)	A2	CIÊNCIA DA COMPUTAÇÃO	Atualizado
1615-147X	Structural and Multidisciplinary Optimization (Print)	A2	CIÊNCIA DA COMPUTAÇÃO	Atualizado
0738-4602	The AI Magazine	A2	CIÊNCIA DA COMPUTAÇÃO	Atualizado
0164-1212	The Journal of Systems and Software	A2	CIÊNCIA DA COMPUTAÇÃO	Atualizado
1066-8888	The VLDB Journal	A2	CIÊNCIA DA COMPUTAÇÃO	Atualizado
1523-2867	ACM SIGPLAN Notices	B1	CIÊNCIA DA COMPUTAÇÃO	Atualizado
1549-6325	ACM Transactions on Algorithms	B1	CIÊNCIA DA COMPUTAÇÃO	Atualizado
1556-4665	ACM Transactions on Autonomous and Adaptive Systems	B1	CIÊNCIA DA COMPUTAÇÃO	Atualizado
1539-9087	ACM Transactions on Embedded Computing Systems	B1	CIÊNCIA DA COMPUTAÇÃO	Atualizado
1556-4681	ACM Transactions on Knowledge Discovery from Data	B1	CIÊNCIA DA COMPUTAÇÃO	Atualizado
0001-5903	Acta Informatica	B1	CIÊNCIA DA COMPUTAÇÃO	Atualizado
1432-0525	Acta Informatica (Internet)	B1	CIÊNCIA DA COMPUTAÇÃO	Atualizado
1059-7123	Adaptive Behavior	B1	CIÊNCIA DA COMPUTAÇÃO	Atualizado
1570-8705	Ad Hoc Networks	B1	CIÊNCIA DA COMPUTAÇÃO	Atualizado
1474-0346	Advanced Engineering Informatics	B1	CIÊNCIA DA COMPUTAÇÃO	Atualizado
0965-9978	Advances in Engineering Software (1992)	B1	CIÊNCIA DA COMPUTAÇÃO	Atualizado
0001-8732	Advances in Physics	B1	CIÊNCIA DA COMPUTAÇÃO	Atualizado
0925-1030	Analog Integrated Circuits and Signal Processing	B1	CIÊNCIA DA COMPUTAÇÃO	Atualizado
1573-1979	Analog Integrated Circuits and Signal Processing (Dordrecht. Online)	B1	CIÊNCIA DA COMPUTAÇÃO	Atualizado
1618-2642	Analytical and Bioanalytical Chemistry (Print)	B1	CIÊNCIA DA COMPUTAÇÃO	Atualizado
0003-2700	Analytical Chemistry (Washington)	B1	CIÊNCIA DA COMPUTAÇÃO	Atualizado
1012-2443	Annals of Mathematics and Artificial Intelligence	B1	CIÊNCIA DA COMPUTAÇÃO	Atualizado
1573-7470	Annals of Mathematics and Artificial Intelligence (Dordrecht. Online)	B1	CIÊNCIA DA COMPUTAÇÃO	Atualizado
0168-0072	Annals of Pure and Applied Logic (Print)	B1	CIÊNCIA DA COMPUTAÇÃO	Atualizado
1550-8382	Annual Review of Information Science and Technology (Online)	B1	CIÊNCIA DA COMPUTAÇÃO	Atualizado
0066-4286	Annual Review of Phytopathology (Print)	B1	CIÊNCIA DA COMPUTAÇÃO	Atualizado
0883-9514	Applied Artificial Intelligence	B1	CIÊNCIA DA COMPUTAÇÃO	Atualizado
0924-669X	Applied Intelligence (Boston)	B1	CIÊNCIA DA COMPUTAÇÃO	Atualizado
1573-7497	Applied Intelligence (Dordrecht. Online)	B1	CIÊNCIA DA COMPUTAÇÃO	Atualizado
0095-4616	Applied Mathematics & Optimization	B1	CIÊNCIA DA COMPUTAÇÃO	Atualizado
0003-6951	Applied Physics Letters	B1	CIÊNCIA DA COMPUTAÇÃO	Atualizado
0890-0604	Artificial Intelligence for Engineering Design, Analysis and Manufacturing	B1	CIÊNCIA DA COMPUTAÇÃO	Atualizado
1469-1760	Artificial Intelligence for Engineering Design, Analysis and Manufacturing (Online)	B1	CIÊNCIA DA COMPUTAÇÃO	Atualizado
0269-2821	Artificial Intelligence Review	B1	CIÊNCIA DA COMPUTAÇÃO	Atualizado
1573-7462	Artificial Intelligence Review (Dordrecht. Online)	B1	CIÊNCIA DA COMPUTAÇÃO	Atualizado
1362-3001	Behaviour & Information Technology (Online)	B1	CIÊNCIA DA COMPUTAÇÃO	Atualizado
0144-929X	Behaviour & Information Technology (Print)	B1	CIÊNCIA DA COMPUTAÇÃO	Atualizado
1538-7305	Bell Labs Technical Journal (Online)	B1	CIÊNCIA DA COMPUTAÇÃO	Atualizado
0006-3835	BIT Numerical Mathematics	B1	CIÊNCIA DA COMPUTAÇÃO	Atualizado
1572-9125	BIT Numerical Mathematics (Dordrecht. Online)	B1	CIÊNCIA DA COMPUTAÇÃO	Atualizado
1471-2164	BMC Genomics	B1	CIÊNCIA DA COMPUTAÇÃO	Atualizado
1755-8794	BMC Medical Genomics	B1	CIÊNCIA DA COMPUTAÇÃO	Atualizado
0896-0267	Brain Topography	B1	CIÊNCIA DA COMPUTAÇÃO	Atualizado
1940-6207	Cancer Prevention Research (Philadelphia)	B1	CIÊNCIA DA COMPUTAÇÃO	Atualizado
0008-543X	Cancer (Print)	B1	CIÊNCIA DA COMPUTAÇÃO	Atualizado
1085-9195	Cell Biochemistry and Biophysics	B1	CIÊNCIA DA COMPUTAÇÃO	Atualizado
0960-0779	Chaos, Solitons and Fractals	B1	CIÊNCIA DA COMPUTAÇÃO	Atualizado
0748-3007	Cladistics (Westport. Print)	B1	CIÊNCIA DA COMPUTAÇÃO	Atualizado
0930-7575	Climate Dynamics	B1	CIÊNCIA DA COMPUTAÇÃO	Atualizado
1078-0432	Clinical Cancer Research (Print)	B1	CIÊNCIA DA COMPUTAÇÃO	Atualizado
0963-5483	Combinatorics, Probability & Computing (Print)	B1	CIÊNCIA DA COMPUTAÇÃO	Atualizado
1069-8299	Communications in Numerical Methods in Engineering	B1	CIÊNCIA DA COMPUTAÇÃO	Atualizado
1420-0597	Computational Geosciences (Amsterdam)	B1	CIÊNCIA DA COMPUTAÇÃO	Atualizado
1467-8640	Computational Intelligence (Online)	B1	CIÊNCIA DA COMPUTAÇÃO	Atualizado
1467-8667	Computer-Aided Civil And Infrastructure Engineering (Online)	B1	CIÊNCIA DA COMPUTAÇÃO	Atualizado
1546-4261	Computer Animation and Virtual Worlds (print)	B1	CIÊNCIA DA COMPUTAÇÃO	Atualizado
0895-6111	Computerized Medical Imaging and Graphics	B1	CIÊNCIA DA COMPUTAÇÃO	Atualizado
1460-2067	Computer Journal (Online)	B1	CIÊNCIA DA COMPUTAÇÃO	Atualizado
0010-4620	Computer Journal (Print)	B1	CIÊNCIA DA COMPUTAÇÃO	Atualizado
1025-5842	Computer Methods in Biomechanics and Biomedical Engineering	B1	CIÊNCIA DA COMPUTAÇÃO	Atualizado
0266-352X	Computers and Geotechnics	B1	CIÊNCIA DA COMPUTAÇÃO	Atualizado
0097-8493	Computers & Graphics	B1	CIÊNCIA DA COMPUTAÇÃO	Atualizado
0010-4825	Computers in Biology and Medicine	B1	CIÊNCIA DA COMPUTAÇÃO	Atualizado
1538-9774	Computers, Informatics, Nursing (Online)	B1	CIÊNCIA DA COMPUTAÇÃO	Atualizado
1095-8363	Computer Speech & Language (Online)	B1	CIÊNCIA DA COMPUTAÇÃO	Atualizado
0885-2308	Computer Speech & Language (Print)	B1	CIÊNCIA DA COMPUTAÇÃO	Atualizado
0167-4048	Computers & Security	B1	CIÊNCIA DA COMPUTAÇÃO	Atualizado
0920-5489	Computer Standards & Interfaces	B1	CIÊNCIA DA COMPUTAÇÃO	Atualizado
1521-9615	Computing in Science & Engineering (Print)	B1	CIÊNCIA DA COMPUTAÇÃO	Atualizado
1436-5057	Computing (Wien. Internet)	B1	CIÊNCIA DA COMPUTAÇÃO	Atualizado
0010-485X	Computing (Wien. Print)	B1	CIÊNCIA DA COMPUTAÇÃO	Atualizado
1360-0494	Connection Science (Online)	B1	CIÊNCIA DA COMPUTAÇÃO	Atualizado
1383-7133	Constraints (Dordrecht)	B1	CIÊNCIA DA COMPUTAÇÃO	Atualizado
1572-9354	Constraints (Dordrecht. Online)	B1	CIÊNCIA DA COMPUTAÇÃO	Atualizado
0324-8569	Control and Cybernetics	B1	CIÊNCIA DA COMPUTAÇÃO	Atualizado
1369-5274	Current Opinion in Microbiology	B1	CIÊNCIA DA COMPUTAÇÃO	Atualizado
1381-6128	Current Pharmaceutical Design (Print)	B1	CIÊNCIA DA COMPUTAÇÃO	Atualizado
0967-0645	Deep-Sea Research. Part 2. Tropical Studies in Oceanography	B1	CIÊNCIA DA COMPUTAÇÃO	Atualizado
1573-7586	Designs, Codes And Cryptography (Dordrecht. Online)	B1	CIÊNCIA DA COMPUTAÇÃO	Atualizado
1095-4333	Digital Signal Processing (Online)	B1	CIÊNCIA DA COMPUTAÇÃO	Atualizado
1432-0444	Discrete and Computational Geometry (Internet)	B1	CIÊNCIA DA COMPUTAÇÃO	Atualizado
1572-5286	Discrete Optimization	B1	CIÊNCIA DA COMPUTAÇÃO	Atualizado
0141-9382	Displays (Guildford)	B1	CIÊNCIA DA COMPUTAÇÃO	Atualizado
0926-8782	Distributed and Parallel Databases	B1	CIÊNCIA DA COMPUTAÇÃO	Atualizado
1573-7578	Distributed and Parallel Databases (Dordrecht. Online)	B1	CIÊNCIA DA COMPUTAÇÃO	Atualizado
0178-2770	Distributed Computing	B1	CIÊNCIA DA COMPUTAÇÃO	Atualizado
1432-0452	Distributed Computing (Internet)	B1	CIÊNCIA DA COMPUTAÇÃO	Atualizado
1574-9541	Ecological Informatics (Print)	B1	CIÊNCIA DA COMPUTAÇÃO	Atualizado
1571-0661	Electronic Notes in Theoretical Computer Science	B1	CIÊNCIA DA COMPUTAÇÃO	Atualizado
0140-9883	Energy Economics	B1	CIÊNCIA DA COMPUTAÇÃO	Atualizado
0264-4401	Engineering Computations	B1	CIÊNCIA DA COMPUTAÇÃO	Atualizado
0177-0667	Engineering with Computers	B1	CIÊNCIA DA COMPUTAÇÃO	Atualizado
1435-5663	Engineering with Computers (Internet)	B1	CIÊNCIA DA COMPUTAÇÃO	Atualizado
1099-4300	Entropy (Basel. Online)	B1	CIÊNCIA DA COMPUTAÇÃO	Atualizado
1687-6180	EURASIP Journal on Advances in Signal Processing (Online)	B1	CIÊNCIA DA COMPUTAÇÃO	Atualizado
1687-6172	EURASIP Journal on Advances in Signal Processing (Print)	B1	CIÊNCIA DA COMPUTAÇÃO	Atualizado
1687-1472	EURASIP Journal on Wireless Communications and Networking	B1	CIÊNCIA DA COMPUTAÇÃO	Atualizado
1095-9971	European Journal of Combinatorics (Online)	B1	CIÊNCIA DA COMPUTAÇÃO	Atualizado
0195-6698	European Journal of Combinatorics (Print)	B1	CIÊNCIA DA COMPUTAÇÃO	Atualizado
1476-9344	European Journal of Information Systems (Online)	B1	CIÊNCIA DA COMPUTAÇÃO	Atualizado
0378-1097	FEMS Microbiology Letters	B1	CIÊNCIA DA COMPUTAÇÃO	Atualizado
0169-2968	Fundamenta Informaticae	B1	CIÊNCIA DA COMPUTAÇÃO	Atualizado
1389-2576	Genetic Programming and Evolvable Machines (Print)	B1	CIÊNCIA DA COMPUTAÇÃO	Atualizado
1474-7596	Genome Biology (Print): Biology for the Post-Genomic Era	B1	CIÊNCIA DA COMPUTAÇÃO	Atualizado
1088-9051	Genome Research	B1	CIÊNCIA DA COMPUTAÇÃO	Atualizado
1384-6175	Geoinformatica (Dordrecht)	B1	CIÊNCIA DA COMPUTAÇÃO	Atualizado
1573-7624	Geoinformatica (Dordrecht. Online)	B1	CIÊNCIA DA COMPUTAÇÃO	Atualizado
1389-6911	ICGA Journal	B1	CIÊNCIA DA COMPUTAÇÃO	Atualizado
1541-4922	IEEE Distributed Systems Online	B1	CIÊNCIA DA COMPUTAÇÃO	Atualizado
1545-598X	IEEE Geoscience and Remote Sensing Letters (Print)	B1	CIÊNCIA DA COMPUTAÇÃO	Atualizado
1041-1135	IEEE Photonics Technology Letters	B1	CIÊNCIA DA COMPUTAÇÃO	Atualizado
1540-7993	IEEE Security & Privacy	B1	CIÊNCIA DA COMPUTAÇÃO	Atualizado
1545-5971	IEEE Transactions on Dependable and Secure Computing	B1	CIÊNCIA DA COMPUTAÇÃO	Atualizado
0018-9359	IEEE Transactions on Education	B1	CIÊNCIA DA COMPUTAÇÃO	Atualizado
1939-1412	IEEE Transactions on Haptics	B1	CIÊNCIA DA COMPUTAÇÃO	Atualizado
1556-6013	IEEE Transactions on Information Forensics and Security	B1	CIÊNCIA DA COMPUTAÇÃO	Atualizado
1524-9050	IEEE Transactions on Intelligent Transportation Systems (Print)	B1	CIÊNCIA DA COMPUTAÇÃO	Atualizado
0885-8993	IEEE Transactions on Power Electronics	B1	CIÊNCIA DA COMPUTAÇÃO	Atualizado
0885-8950	IEEE Transactions on Power Systems	B1	CIÊNCIA DA COMPUTAÇÃO	Atualizado
0916-8524	IEICE Transactions on Electronics	B1	CIÊNCIA DA COMPUTAÇÃO	Atualizado
0916-8508	IEICE Transactions on Fundamentals of Electronics, Communications and Computer Science	B1	CIÊNCIA DA COMPUTAÇÃO	Atualizado
0916-8532	IEICE Transactions on Information and Systems	B1	CIÊNCIA DA COMPUTAÇÃO	Atualizado
1751-8628	IET Communications (Print)	B1	CIÊNCIA DA COMPUTAÇÃO	Atualizado
1751-861X	IET Computers & Digital Techniques (Online)	B1	CIÊNCIA DA COMPUTAÇÃO	Atualizado
1751-8601	IET Computers & Digital Techniques (Print)	B1	CIÊNCIA DA COMPUTAÇÃO	Atualizado
1751-8814	IET Software (Online)	B1	CIÊNCIA DA COMPUTAÇÃO	Atualizado
1751-8806	IET Software (Print)	B1	CIÊNCIA DA COMPUTAÇÃO	Atualizado
1566-2535	Information Fusion (Print)	B1	CIÊNCIA DA COMPUTAÇÃO	Atualizado
1386-4564	Information Retrieval (Boston)	B1	CIÊNCIA DA COMPUTAÇÃO	Atualizado
1573-7659	Information Retrieval (Dordrecht. Online)	B1	CIÊNCIA DA COMPUTAÇÃO	Atualizado
1572-9419	Information Systems Frontiers (Dordrecht. Online)	B1	CIÊNCIA DA COMPUTAÇÃO	Atualizado
1387-3326	Information Systems Frontiers (Print)	B1	CIÊNCIA DA COMPUTAÇÃO	Atualizado
1058-0530	Information Systems Management	B1	CIÊNCIA DA COMPUTAÇÃO	Atualizado
1385-951X	Information Technology and Management	B1	CIÊNCIA DA COMPUTAÇÃO	Atualizado
1473-8716	Information Visualization (Print)	B1	CIÊNCIA DA COMPUTAÇÃO	Atualizado
0953-5438	Interacting with Computers	B1	CIÊNCIA DA COMPUTAÇÃO	Atualizado
1560-4292	International Journal of Artificial Intelligence in Education (Print)	B1	CIÊNCIA DA COMPUTAÇÃO	Atualizado
0218-1959	International Journal of Computational Geometry and Applications	B1	CIÊNCIA DA COMPUTAÇÃO	Atualizado
1362-3052	International Journal of Computer Integrated Manufacturing (Online)	B1	CIÊNCIA DA COMPUTAÇÃO	Atualizado
0951-192X	International Journal of Computer Integrated Manufacturing (Print)	B1	CIÊNCIA DA COMPUTAÇÃO	Atualizado
0218-8430	International Journal of Cooperative Information Systems (Singapore)	B1	CIÊNCIA DA COMPUTAÇÃO	Atualizado
1362-3060	International Journal of Electronics (Online)	B1	CIÊNCIA DA COMPUTAÇÃO	Atualizado
0020-7217	International Journal of Electronics (Print)	B1	CIÊNCIA DA COMPUTAÇÃO	Atualizado
1532-7590	International Journal of Human-Computer Interaction (Online)	B1	CIÊNCIA DA COMPUTAÇÃO	Atualizado
0360-3199	International Journal of Hydrogen Energy	B1	CIÊNCIA DA COMPUTAÇÃO	Atualizado
1615-5262	International Journal of Information Security (Print)	B1	CIÊNCIA DA COMPUTAÇÃO	Atualizado
1098-111X	International Journal of Intelligent Systems (Online)	B1	CIÊNCIA DA COMPUTAÇÃO	Atualizado
0884-8173	International Journal of Intelligent Systems (Print)	B1	CIÊNCIA DA COMPUTAÇÃO	Atualizado
0218-0014	International Journal of Pattern Recognition and Artificial Intelligence	B1	CIÊNCIA DA COMPUTAÇÃO	Atualizado
0020-7543	International Journal of Production Research (Print)	B1	CIÊNCIA DA COMPUTAÇÃO	Atualizado
1099-047X	International Journal of RF and Microwave Computer-Aided Engineering (Online)	B1	CIÊNCIA DA COMPUTAÇÃO	Atualizado
0218-4885	International Journal of Uncertainty, Fuzziness and Knowledge-Based Systems	B1	CIÊNCIA DA COMPUTAÇÃO	Atualizado
1741-1114	International Journal of Web and Grid Services (Online)	B1	CIÊNCIA DA COMPUTAÇÃO	Atualizado
1741-1106	International Journal of Web and Grid Services (Print)	B1	CIÊNCIA DA COMPUTAÇÃO	Atualizado
1433-2833	International Journal on Document Analysis and Recognition (Print)	B1	CIÊNCIA DA COMPUTAÇÃO	Atualizado
1537-2456	International Journal on E-Learning	B1	CIÊNCIA DA COMPUTAÇÃO	Atualizado
1542-7951	Internet Mathematics (Print)	B1	CIÊNCIA DA COMPUTAÇÃO	Atualizado
1066-2243	Internet Research	B1	CIÊNCIA DA COMPUTAÇÃO	Atualizado
0146-0404	Investigative Ophthalmology & Visual Science	B1	CIÊNCIA DA COMPUTAÇÃO	Atualizado
1097-4628	Journal of Applied Polymer Science (Online)	B1	CIÊNCIA DA COMPUTAÇÃO	Atualizado
1573-0670	Journal of Automated Reasoning (Dordrecht. Online)	B1	CIÊNCIA DA COMPUTAÇÃO	Atualizado
0219-7200	Journal of Bioinformatics and Computational Biology (Print)	B1	CIÊNCIA DA COMPUTAÇÃO	Atualizado
1549-960X	Journal of Chemical Information and Modeling (Online)	B1	CIÊNCIA DA COMPUTAÇÃO	Atualizado
1549-9618	Journal of Chemical Theory and Computation	B1	CIÊNCIA DA COMPUTAÇÃO	Atualizado
0095-1137	Journal of Clinical Microbiology (Print)	B1	CIÊNCIA DA COMPUTAÇÃO	Atualizado
1386-6532	Journal of Clinical Virology	B1	CIÊNCIA DA COMPUTAÇÃO	Atualizado
1382-6905	Journal of Combinatorial Optimization	B1	CIÊNCIA DA COMPUTAÇÃO	Atualizado
1573-2886	Journal of Combinatorial Optimization (Dordrecht. Online)	B1	CIÊNCIA DA COMPUTAÇÃO	Atualizado
0097-3165	Journal of Combinatorial Theory. Series A (Print)	B1	CIÊNCIA DA COMPUTAÇÃO	Atualizado
0095-8956	Journal of Combinatorial Theory. Series B (Print)	B1	CIÊNCIA DA COMPUTAÇÃO	Atualizado
1090-2708	Journal of Complexity (Online)	B1	CIÊNCIA DA COMPUTAÇÃO	Atualizado
0885-064X	Journal of Complexity (Print)	B1	CIÊNCIA DA COMPUTAÇÃO	Atualizado
1061-8600	Journal of Computational and Graphical Statistics	B1	CIÊNCIA DA COMPUTAÇÃO	Atualizado
0928-1045	Journal of Computer-Aided Materials Design	B1	CIÊNCIA DA COMPUTAÇÃO	Atualizado
0887-3801	Journal of Computing in Civil Engineering	B1	CIÊNCIA DA COMPUTAÇÃO	Atualizado
0944-6532	Journal of Convex Analysis	B1	CIÊNCIA DA COMPUTAÇÃO	Atualizado
0897-1889	Journal of Digital Imaging	B1	CIÊNCIA DA COMPUTAÇÃO	Atualizado
1618-727X	Journal of Digital Imaging (Internet)	B1	CIÊNCIA DA COMPUTAÇÃO	Atualizado
0378-8741	Journal of Ethnopharmacology	B1	CIÊNCIA DA COMPUTAÇÃO	Atualizado
1469-7653	Journal of Functional Programming (Online)	B1	CIÊNCIA DA COMPUTAÇÃO	Atualizado
0148-0227	Journal of Geophysical Research	B1	CIÊNCIA DA COMPUTAÇÃO	Atualizado
1097-0118	Journal of Graph Theory (Online)	B1	CIÊNCIA DA COMPUTAÇÃO	Atualizado
0364-9024	Journal of Graph Theory (Print)	B1	CIÊNCIA DA COMPUTAÇÃO	Atualizado
1570-7873	Journal of Grid Computing	B1	CIÊNCIA DA COMPUTAÇÃO	Atualizado
0304-3894	Journal of Hazardous Materials (Print)	B1	CIÊNCIA DA COMPUTAÇÃO	Atualizado
0165-5515	Journal of Information Science	B1	CIÊNCIA DA COMPUTAÇÃO	Atualizado
1466-4437	Journal of Information Technology (Online)	B1	CIÊNCIA DA COMPUTAÇÃO	Atualizado
0925-9902	Journal of Intelligent Information Systems	B1	CIÊNCIA DA COMPUTAÇÃO	Atualizado
1573-7675	Journal of Intelligent Information Systems (Dordrecht. Online)	B1	CIÊNCIA DA COMPUTAÇÃO	Atualizado
1572-8145	Journal of Intelligent Manufacturing (Dordrecht. Online)	B1	CIÊNCIA DA COMPUTAÇÃO	Atualizado
0921-0296	Journal of Intelligent & Robotic Systems	B1	CIÊNCIA DA COMPUTAÇÃO	Atualizado
1573-0409	Journal of Intelligent & Robotic Systems (Dordrecht. Online)	B1	CIÊNCIA DA COMPUTAÇÃO	Atualizado
0733-8724	Journal of Lightwave Technology (Print)	B1	CIÊNCIA DA COMPUTAÇÃO	Atualizado
1567-8326	Journal of Logic and Algebraic Programming	B1	CIÊNCIA DA COMPUTAÇÃO	Atualizado
1465-363X	Journal of Logic and Computation (Online)	B1	CIÊNCIA DA COMPUTAÇÃO	Atualizado
0955-792X	Journal of Logic and Computation (Print)	B1	CIÊNCIA DA COMPUTAÇÃO	Atualizado
0924-9907	Journal of Mathematical Imaging and Vision	B1	CIÊNCIA DA COMPUTAÇÃO	Atualizado
1573-7683	Journal of Mathematical Imaging and Vision (Dordrecht. Online)	B1	CIÊNCIA DA COMPUTAÇÃO	Atualizado
0022-2836	Journal of Molecular Biology	B1	CIÊNCIA DA COMPUTAÇÃO	Atualizado
1084-8045	Journal of Network and Computer Applications	B1	CIÊNCIA DA COMPUTAÇÃO	Atualizado
1095-8592	Journal of Network and Computer Applications (Online)	B1	CIÊNCIA DA COMPUTAÇÃO	Atualizado
1943-0620	Journal of Optical Communications and Networking (Print)	B1	CIÊNCIA DA COMPUTAÇÃO	Atualizado
1861-8200	Journal of Real-Time Image Processing (Print)	B1	CIÊNCIA DA COMPUTAÇÃO	Atualizado
1094-6136	Journal of Scheduling	B1	CIÊNCIA DA COMPUTAÇÃO	Atualizado
1939-8018	Journal of Signal Processing Systems for Signal, Image, and Video Technology	B1	CIÊNCIA DA COMPUTAÇÃO	Atualizado
1939-8115	Journal of Signal Processing Systems for Signal, Image, and Video Technology (Online)	B1	CIÊNCIA DA COMPUTAÇÃO	Atualizado
0094-9655	Journal of Statistical Computation and Simulation (Print)	B1	CIÊNCIA DA COMPUTAÇÃO	Atualizado
0747-7171	Journal of Symbolic Computation	B1	CIÊNCIA DA COMPUTAÇÃO	Atualizado
1095-855X	Journal of Symbolic Computation (Online)	B1	CIÊNCIA DA COMPUTAÇÃO	Atualizado
1383-7621	Journal of Systems Architecture	B1	CIÊNCIA DA COMPUTAÇÃO	Atualizado
0160-5682	Journal of the Operational Research Society	B1	CIÊNCIA DA COMPUTAÇÃO	Atualizado
1071-0922	Journal of the Society for Information Display	B1	CIÊNCIA DA COMPUTAÇÃO	Atualizado
0948-6968	Journal of Universal Computer Science (Online)	B1	CIÊNCIA DA COMPUTAÇÃO	Atualizado
0948-695X	Journal of Universal Computer Science (Print)	B1	CIÊNCIA DA COMPUTAÇÃO	Atualizado
1047-3203	Journal of Visual Communication and Image Representation (Print)	B1	CIÊNCIA DA COMPUTAÇÃO	Atualizado
1045-926X	Journal of Visual Languages and Computing	B1	CIÊNCIA DA COMPUTAÇÃO	Atualizado
1095-8533	Journal of Visual Languages and Computing (Online)	B1	CIÊNCIA DA COMPUTAÇÃO	Atualizado
0950-7051	Knowledge-Based Systems	B1	CIÊNCIA DA COMPUTAÇÃO	Atualizado
1469-8005	Knowledge Engineering Review (Online)	B1	CIÊNCIA DA COMPUTAÇÃO	Atualizado
0922-6567	Machine Translation	B1	CIÊNCIA DA COMPUTAÇÃO	Atualizado
0932-8092	Machine Vision and Applications	B1	CIÊNCIA DA COMPUTAÇÃO	Atualizado
1432-1769	Machine Vision and Applications (Internet)	B1	CIÊNCIA DA COMPUTAÇÃO	Atualizado
0170-4214	Mathematical Methods in the Applied Sciences	B1	CIÊNCIA DA COMPUTAÇÃO	Atualizado
1099-1476	Mathematical Methods in the Applied Sciences (Online)	B1	CIÊNCIA DA COMPUTAÇÃO	Atualizado
0378-4754	Mathematics and Computers in Simulation (Print)	B1	CIÊNCIA DA COMPUTAÇÃO	Atualizado
0094-2405	Medical Physics (Lancaster)	B1	CIÊNCIA DA COMPUTAÇÃO	Atualizado
0026-1270	Methods of Information in Medicine	B1	CIÊNCIA DA COMPUTAÇÃO	Atualizado
0959-8324	Microelectronics Journal	B1	CIÊNCIA DA COMPUTAÇÃO	Atualizado
0894-0282	Molecular Plant-Microbe Interactions	B1	CIÊNCIA DA COMPUTAÇÃO	Atualizado
0954-898X	Network (Bristol. Print)	B1	CIÊNCIA DA COMPUTAÇÃO	Atualizado
1361-6536	Network (London, 1990)	B1	CIÊNCIA DA COMPUTAÇÃO	Atualizado
0028-3045	Networks (New York, N.Y. Print)	B1	CIÊNCIA DA COMPUTAÇÃO	Atualizado
1097-0037	Networks (New York Online)	B1	CIÊNCIA DA COMPUTAÇÃO	Atualizado
1370-4621	Neural Processing Letters	B1	CIÊNCIA DA COMPUTAÇÃO	Atualizado
1573-773X	Neural Processing Letters (Online)	B1	CIÊNCIA DA COMPUTAÇÃO	Atualizado
1367-2630	New Journal of Physics	B1	CIÊNCIA DA COMPUTAÇÃO	Atualizado
0305-1048	Nucleic Acids Research	B1	CIÊNCIA DA COMPUTAÇÃO	Atualizado
1362-4962	Nucleic Acids Research (Online)	B1	CIÊNCIA DA COMPUTAÇÃO	Atualizado
1017-1398	Numerical Algorithms	B1	CIÊNCIA DA COMPUTAÇÃO	Atualizado
0163-0563	Numerical Functional Analysis and Optimization	B1	CIÊNCIA DA COMPUTAÇÃO	Atualizado
0305-0483	Omega (Oxford)	B1	CIÊNCIA DA COMPUTAÇÃO	Atualizado
0163-5980	Operating Systems Review	B1	CIÊNCIA DA COMPUTAÇÃO	Atualizado
0167-6377	Operations Research Letters	B1	CIÊNCIA DA COMPUTAÇÃO	Atualizado
1573-4277	Optical Switching and Networking (Print)	B1	CIÊNCIA DA COMPUTAÇÃO	Atualizado
1094-4087	Optics Express	B1	CIÊNCIA DA COMPUTAÇÃO	Atualizado
1862-4472	Optimization Letters (Print)	B1	CIÊNCIA DA COMPUTAÇÃO	Atualizado
1029-4937	Optimization Methods and Software (Online)	B1	CIÊNCIA DA COMPUTAÇÃO	Atualizado
1055-6788	Optimization Methods & Software (Print)	B1	CIÊNCIA DA COMPUTAÇÃO	Atualizado
1433-755X	Pattern Analysis and Applications	B1	CIÊNCIA DA COMPUTAÇÃO	Atualizado
1433-7541	Pattern Analysis and Applications (Print)	B1	CIÊNCIA DA COMPUTAÇÃO	Atualizado
0163-5999	Performance Evaluation Review	B1	CIÊNCIA DA COMPUTAÇÃO	Atualizado
1617-4909	Personal and Ubiquitous Computing (Print)	B1	CIÊNCIA DA COMPUTAÇÃO	Atualizado
1550-2376	Physical Review E (Statistical, Nonlinear, and Soft Matter Physics)	B1	CIÊNCIA DA COMPUTAÇÃO	Atualizado
1539-3755	Physical Review. E, Statistical, Nonlinear, and Soft Matter Physics (Print)	B1	CIÊNCIA DA COMPUTAÇÃO	Atualizado
0375-9601	Physics Letters. A (Print)	B1	CIÊNCIA DA COMPUTAÇÃO	Atualizado
1571-0645	Physics of Life Reviews (Print)	B1	CIÊNCIA DA COMPUTAÇÃO	Atualizado
0721-7714	Plant Cell Reports (Print)	B1	CIÊNCIA DA COMPUTAÇÃO	Atualizado
1553-7390	PLOS Genetics	B1	CIÊNCIA DA COMPUTAÇÃO	Atualizado
1553-7404	PLOS Genetics (Online)	B1	CIÊNCIA DA COMPUTAÇÃO	Atualizado
1615-9853	Proteomics (Weinheim. Print)	B1	CIÊNCIA DA COMPUTAÇÃO	Atualizado
1572-9443	Queueing Systems (Online)	B1	CIÊNCIA DA COMPUTAÇÃO	Atualizado
1042-9832	Random Structures & Algorithms (Print)	B1	CIÊNCIA DA COMPUTAÇÃO	Atualizado
1573-1383	Real-Time Systems (Online)	B1	CIÊNCIA DA COMPUTAÇÃO	Atualizado
1432-010X	Requirements Engineering	B1	CIÊNCIA DA COMPUTAÇÃO	Atualizado
0947-3602	Requirements Engineering (London. Print)	B1	CIÊNCIA DA COMPUTAÇÃO	Atualizado
0167-6423	Science of Computer Programming (Print)	B1	CIÊNCIA DA COMPUTAÇÃO	Atualizado
0925-4005	Sensors and Actuators. B, Chemical	B1	CIÊNCIA DA COMPUTAÇÃO	Atualizado
1095-7146	SIAM Journal on Discrete Mathematics	B1	CIÊNCIA DA COMPUTAÇÃO	Atualizado
0895-4801	SIAM Journal on Discrete Mathematics (Print)	B1	CIÊNCIA DA COMPUTAÇÃO	Atualizado
1619-1366	Software and Systems Modeling (Print)	B1	CIÊNCIA DA COMPUTAÇÃO	Atualizado
1099-1689	Software Testing, Verification and Reliability	B1	CIÊNCIA DA COMPUTAÇÃO	Atualizado
0960-0833	Software Testing, Verification & Reliability	B1	CIÊNCIA DA COMPUTAÇÃO	Atualizado
1573-1375	Statistics and Computing (Online)	B1	CIÊNCIA DA COMPUTAÇÃO	Atualizado
1018-4864	Telecommunications Systems	B1	CIÊNCIA DA COMPUTAÇÃO	Atualizado
1572-9451	Telecommunication Systems	B1	CIÊNCIA DA COMPUTAÇÃO	Atualizado
1530-5627	Telemedicine Journal and e-Health	B1	CIÊNCIA DA COMPUTAÇÃO	Atualizado
0002-9637	The American Journal of Tropical Medicine and Hygiene	B1	CIÊNCIA DA COMPUTAÇÃO	Atualizado
1079-8986	The Bulletin of Symbolic Logic	B1	CIÊNCIA DA COMPUTAÇÃO	Atualizado
1094-3420	The International Journal of High Performance Computing Applications	B1	CIÊNCIA DA COMPUTAÇÃO	Atualizado
0021-9258	The Journal of Biological Chemistry (Print)	B1	CIÊNCIA DA COMPUTAÇÃO	Atualizado
0887-4417	The Journal of Computer Information Systems	B1	CIÊNCIA DA COMPUTAÇÃO	Atualizado
1126-6708	The Journal of High Energy Physics	B1	CIÊNCIA DA COMPUTAÇÃO	Atualizado
0163-4453	The Journal of Infection	B1	CIÊNCIA DA COMPUTAÇÃO	Atualizado
0270-6474	The Journal of Neuroscience	B1	CIÊNCIA DA COMPUTAÇÃO	Atualizado
1471-0684	Theory and Practice of Logic Programming	B1	CIÊNCIA DA COMPUTAÇÃO	Atualizado
1475-3081	Theory and Practice of Logic Programming (Online)	B1	CIÊNCIA DA COMPUTAÇÃO	Atualizado
0178-2789	The Visual Computer	B1	CIÊNCIA DA COMPUTAÇÃO	Atualizado
1432-2315	The Visual Computer (Internet)	B1	CIÊNCIA DA COMPUTAÇÃO	Atualizado
1615-5289	Universal Access in the Information Society (Print)	B1	CIÊNCIA DA COMPUTAÇÃO	Atualizado
1573-1391	User Modeling and User-Adapted Interaction (Online)	B1	CIÊNCIA DA COMPUTAÇÃO	Atualizado
1530-8677	Wireless Communications and Mobile Computing	B1	CIÊNCIA DA COMPUTAÇÃO	Atualizado
