ISSN	Título	Estrato	Área de Avaliação	Status
0149-1970	Progress in Nuclear Energy (New Series)	B2	CIÊNCIA DA COMPUTAÇÃO	Atualizado
0375-9687	Progress of Theoretical Physics. Supplement	B2	CIÊNCIA DA COMPUTAÇÃO	Atualizado
0033-569X	Quarterly of Applied Mathematics	B2	CIÊNCIA DA COMPUTAÇÃO	Atualizado
0100-4042	Química Nova (Impresso)	B2	CIÊNCIA DA COMPUTAÇÃO	Atualizado
0951-8320	Reliability Engineering & Systems Safety	B2	CIÊNCIA DA COMPUTAÇÃO	Atualizado
0034-7299	Revista Brasileira de Otorrinolaringologia (Impresso)	B2	CIÊNCIA DA COMPUTAÇÃO	Atualizado
1806-9312	Revista Brasileira de Otorrinolaringologia (Online)	B2	CIÊNCIA DA COMPUTAÇÃO	Atualizado
1516-4446	Revista Brasileira de Psiquiatria (São Paulo. 1999. Impresso)	B2	CIÊNCIA DA COMPUTAÇÃO	Atualizado
1547-6286	RNA Biology	B2	CIÊNCIA DA COMPUTAÇÃO	Atualizado
0263-5747	Robotica (Cambridge. Print)	B2	CIÊNCIA DA COMPUTAÇÃO	Atualizado
1062-936X	SAR and QSAR in Environmental Research (Print)	B2	CIÊNCIA DA COMPUTAÇÃO	Atualizado
0037-1998	Semiotica (Berlin)	B2	CIÊNCIA DA COMPUTAÇÃO	Atualizado
1863-2386	Service Oriented Computing and Applications	B2	CIÊNCIA DA COMPUTAÇÃO	Atualizado
0927-6947	Set-Valued Analysis	B2	CIÊNCIA DA COMPUTAÇÃO	Atualizado
1569-190X	Simulation Modelling Practice and Theory	B2	CIÊNCIA DA COMPUTAÇÃO	Atualizado
0894-4393	Social Science Computer Review	B2	CIÊNCIA DA COMPUTAÇÃO	Atualizado
1099-1670	Software Process Improvement and Practice (Online)	B2	CIÊNCIA DA COMPUTAÇÃO	Atualizado
1077-4866	Software Process Improvement and Practice (Print)	B2	CIÊNCIA DA COMPUTAÇÃO	Atualizado
0963-9314	Software Quality Journal	B2	CIÊNCIA DA COMPUTAÇÃO	Atualizado
1573-1367	Software Quality Journal (Online)	B2	CIÊNCIA DA COMPUTAÇÃO	Atualizado
0167-1987	Soil & Tillage Research	B2	CIÊNCIA DA COMPUTAÇÃO	Atualizado
0038-0938	Solar Physics	B2	CIÊNCIA DA COMPUTAÇÃO	Atualizado
1476-3141	Sports Biomechanics	B2	CIÊNCIA DA COMPUTAÇÃO	Atualizado
0962-2802	Statistical Methods in Medical Research	B2	CIÊNCIA DA COMPUTAÇÃO	Atualizado
1471-082X	Statistical Modelling	B2	CIÊNCIA DA COMPUTAÇÃO	Atualizado
0277-6715	Statistics in Medicine (Print)	B2	CIÊNCIA DA COMPUTAÇÃO	Atualizado
0167-7152	Statistics & Probability Letters	B2	CIÊNCIA DA COMPUTAÇÃO	Atualizado
1436-3240	Stochastic Environmental Research and Risk Assessment (Print)	B2	CIÊNCIA DA COMPUTAÇÃO	Atualizado
0039-3215	Studia Logica	B2	CIÊNCIA DA COMPUTAÇÃO	Atualizado
0926-9630	Studies in Health Technology and Informatics	B2	CIÊNCIA DA COMPUTAÇÃO	Atualizado
0039-7857	Synthese (Dordrecht)	B2	CIÊNCIA DA COMPUTAÇÃO	Atualizado
1573-0964	Synthese (Dordrecht. Online)	B2	CIÊNCIA DA COMPUTAÇÃO	Atualizado
1055-4181	Technology and Disability	B2	CIÊNCIA DA COMPUTAÇÃO	Atualizado
1133-0686	Test (Madrid)	B2	CIÊNCIA DA COMPUTAÇÃO	Atualizado
0002-9890	The American Mathematical Monthly	B2	CIÊNCIA DA COMPUTAÇÃO	Atualizado
1077-8926	The Electronic Journal of Combinatorics	B2	CIÊNCIA DA COMPUTAÇÃO	Atualizado
1434-6028	The European Physical Journal. B, Condensed Matter Physics (Print)	B2	CIÊNCIA DA COMPUTAÇÃO	Atualizado
1478-5951	The International Journal of Medical Robotics and Computer Assisted Surgery (Print)	B2	CIÊNCIA DA COMPUTAÇÃO	Atualizado
1465-1211	The Journal of Risk	B2	CIÊNCIA DA COMPUTAÇÃO	Atualizado
1573-0484	The Journal of Supercomputing (Dordrecht. Online)	B2	CIÊNCIA DA COMPUTAÇÃO	Atualizado
1432-4350	Theory of Computing Systems	B2	CIÊNCIA DA COMPUTAÇÃO	Atualizado
0272-4987	The Quarterly Journal of Experimental Psychology. A, Human Experimental Psychology	B2	CIÊNCIA DA COMPUTAÇÃO	Atualizado
0041-0101	Toxicon (Oxford)	B2	CIÊNCIA DA COMPUTAÇÃO	Atualizado
1361-1682	Transactions in GIS (Print)	B2	CIÊNCIA DA COMPUTAÇÃO	Atualizado
0041-1132	Transfusion (Arlington, Va.)	B2	CIÊNCIA DA COMPUTAÇÃO	Atualizado
0041-1345	Transplantation Proceedings	B2	CIÊNCIA DA COMPUTAÇÃO	Atualizado
0968-090X	Transportation Research. Part C, Emerging Technologies	B2	CIÊNCIA DA COMPUTAÇÃO	Atualizado
0041-1655	Transportation Science	B2	CIÊNCIA DA COMPUTAÇÃO	Atualizado
1359-4338	Virtual Reality (Waltham Cross)	B2	CIÊNCIA DA COMPUTAÇÃO	Atualizado
1065-514X	VLSI Design	B2	CIÊNCIA DA COMPUTAÇÃO	Atualizado
0043-1737	Weed Research (Print)	B2	CIÊNCIA DA COMPUTAÇÃO	Atualizado
1051-9815	Work (Reading, MA)	B2	CIÊNCIA DA COMPUTAÇÃO	Atualizado
0939-5075	Zeitschrift fur Naturforschung. C, A Journal of Biosciences	B2	CIÊNCIA DA COMPUTAÇÃO	Atualizado
1084-6654	ACM Journal of Experimental Algorithmics	B3	CIÊNCIA DA COMPUTAÇÃO	Atualizado
0065-2458	Advances in Computers	B3	CIÊNCIA DA COMPUTAÇÃO	Atualizado
0273-1177	Advances in Space Research	B3	CIÊNCIA DA COMPUTAÇÃO	Atualizado
1434-8411	AEU. International Journal of Electronics and Communications (Print)	B3	CIÊNCIA DA COMPUTAÇÃO	Atualizado
0003-4347	Annales des Telecommunications	B3	CIÊNCIA DA COMPUTAÇÃO	Atualizado
0218-0006	Annals of Combinatorics (Print)	B3	CIÊNCIA DA COMPUTAÇÃO	Atualizado
0918-7960	Anthropological Science	B3	CIÊNCIA DA COMPUTAÇÃO	Atualizado
1559-128X	Applied Optics	B3	CIÊNCIA DA COMPUTAÇÃO	Atualizado
0969-8043	Applied Radiation and Isotopes	B3	CIÊNCIA DA COMPUTAÇÃO	Atualizado
0167-4943	Archives of Gerontology and Geriatrics	B3	CIÊNCIA DA COMPUTAÇÃO	Atualizado
0001-253X	ASLIB Proceedings	B3	CIÊNCIA DA COMPUTAÇÃO	Atualizado
1916-2790	Botany (Ottawa. Print)	B3	CIÊNCIA DA COMPUTAÇÃO	Atualizado
0143-6244	Building Services Engineering Research & Technology	B3	CIÊNCIA DA COMPUTAÇÃO	Atualizado
1463-7154	Business Process Management Journal	B3	CIÊNCIA DA COMPUTAÇÃO	Atualizado
0840-8688	Canadian Journal of Electrical and Computer Engineering	B3	CIÊNCIA DA COMPUTAÇÃO	Atualizado
0923-2958	Celestial Mechanics & Dynamical Astronomy	B3	CIÊNCIA DA COMPUTAÇÃO	Atualizado
1539-6746	Communications in Mathematical Sciences	B3	CIÊNCIA DA COMPUTAÇÃO	Atualizado
0332-1649	Compel (Bradford)	B3	CIÊNCIA DA COMPUTAÇÃO	Atualizado
2238-3603	Computational and Applied Mathematics	B3	CIÊNCIA DA COMPUTAÇÃO	Atualizado
0927-7099	Computational Economics	B3	CIÊNCIA DA COMPUTAÇÃO	Atualizado
0918-6654	Computational Fluid Dynamics Journal	B3	CIÊNCIA DA COMPUTAÇÃO	Atualizado
1061-3773	Computer Applications in Engineering Education	B3	CIÊNCIA DA COMPUTAÇÃO	Atualizado
0271-4159	Computer Graphics World	B3	CIÊNCIA DA COMPUTAÇÃO	Atualizado
1477-8424	Computer Languages, Systems & Structures	B3	CIÊNCIA DA COMPUTAÇÃO	Atualizado
1544-3574	Computers in Entertainment	B3	CIÊNCIA DA COMPUTAÇÃO	Atualizado
0925-9724	Computer Supported Cooperative Work	B3	CIÊNCIA DA COMPUTAÇÃO	Atualizado
0267-6192	Computer Systems Science and Engineering	B3	CIÊNCIA DA COMPUTAÇÃO	Atualizado
1335-9150	Computing and Informatics	B3	CIÊNCIA DA COMPUTAÇÃO	Atualizado
1063-293X	Concurrent Engineering: Research and Applications	B3	CIÊNCIA DA COMPUTAÇÃO	Atualizado
0935-1175	Continuum Mechanics and Thermodynamics (Print)	B3	CIÊNCIA DA COMPUTAÇÃO	Atualizado
1051-2004	Digital Signal Processing (Print)	B3	CIÊNCIA DA COMPUTAÇÃO	Atualizado
1865-0481	Earth Science Informatics (Internet)	B3	CIÊNCIA DA COMPUTAÇÃO	Atualizado
1865-0473	Earth Science Informatics (Print)	B3	CIÊNCIA DA COMPUTAÇÃO	Atualizado
1464-3839	Edinburgh Mathematical Society. Proceedings	B3	CIÊNCIA DA COMPUTAÇÃO	Atualizado
1577-5097	ELCVIA. Electronic letters on computer vision and image analysis	B3	CIÊNCIA DA COMPUTAÇÃO	Atualizado
0948-7921	Electrical Engineering (Berlin. Print)	B3	CIÊNCIA DA COMPUTAÇÃO	Atualizado
1532-5008	Electric Power Components and Systems	B3	CIÊNCIA DA COMPUTAÇÃO	Atualizado
1571-0653	Electronic Notes in Discrete Mathematics	B3	CIÊNCIA DA COMPUTAÇÃO	Atualizado
1363-2078	Engineering Intelligent Systems: for electrical engineering and communications	B3	CIÊNCIA DA COMPUTAÇÃO	Atualizado
1687-4153	EURASIP Journal on Bioinformatics and Systems Biology (Online)	B3	CIÊNCIA DA COMPUTAÇÃO	Atualizado
1684-5285	European Journal for the Informatics Professional	B3	CIÊNCIA DA COMPUTAÇÃO	Atualizado
1415-4757	Genetics and Molecular Biology (Impresso)	B3	CIÊNCIA DA COMPUTAÇÃO	Atualizado
1058-6180	IEEE Annals of the History of Computing	B3	CIÊNCIA DA COMPUTAÇÃO	Atualizado
1359-7019	IEE Proceedings. Communications (Online)	B3	CIÊNCIA DA COMPUTAÇÃO	Atualizado
1745-1345	IEICE Transactions on Communications (Online)	B3	CIÊNCIA DA COMPUTAÇÃO	Atualizado
1751-858X	IET Circuits, Devices & Systems (Print)	B3	CIÊNCIA DA COMPUTAÇÃO	Atualizado
0740-817X	IIE Transactions	B3	CIÊNCIA DA COMPUTAÇÃO	Atualizado
0272-4960	IMA Journal of Applied Mathematics	B3	CIÊNCIA DA COMPUTAÇÃO	Atualizado
1471-678X	IMA Journal of Management Mathematics (Print)	B3	CIÊNCIA DA COMPUTAÇÃO	Atualizado
1753-8165	Informatics for Health and Social Care (Online)	B3	CIÊNCIA DA COMPUTAÇÃO	Atualizado
1648-5831	Informatics in Education	B3	CIÊNCIA DA COMPUTAÇÃO	Atualizado
0268-1102	Information Technology for Development	B3	CIÊNCIA DA COMPUTAÇÃO	Atualizado
1614-5054	Innovations in Systems and Software Engineering (Internet)	B3	CIÊNCIA DA COMPUTAÇÃO	Atualizado
1614-5046	Innovations in Systems and Software Engineering (Print)	B3	CIÊNCIA DA COMPUTAÇÃO	Atualizado
1137-3601	Inteligencia Artificial	B3	CIÊNCIA DA COMPUTAÇÃO	Atualizado
1079-8587	Intelligent Automation and Soft Computing	B3	CIÊNCIA DA COMPUTAÇÃO	Atualizado
1741-5659	Interactive Technology and Smart Education	B3	CIÊNCIA DA COMPUTAÇÃO	Atualizado
1746-1375	International Journal of Agent-Oriented Software Engineering (Print)	B3	CIÊNCIA DA COMPUTAÇÃO	Atualizado
1383-5416	International Journal of Applied Electromagnetics and Mechanics	B3	CIÊNCIA DA COMPUTAÇÃO	Atualizado
1311-1728	International Journal of Applied Mathematics	B3	CIÊNCIA DA COMPUTAÇÃO	Atualizado
1744-5493	International Journal of Bioinformatics Research and Applications (Online)	B3	CIÊNCIA DA COMPUTAÇÃO	Atualizado
1744-5485	International Journal of Bioinformatics Research and Applications (Print)	B3	CIÊNCIA DA COMPUTAÇÃO	Atualizado
1743-8187	International Journal of Business Intelligence and Data Mining	B3	CIÊNCIA DA COMPUTAÇÃO	Atualizado
1099-1131	International Journal of Communication Systems (Online)	B3	CIÊNCIA DA COMPUTAÇÃO	Atualizado
1074-5351	International Journal of Communication Systems (Print)	B3	CIÊNCIA DA COMPUTAÇÃO	Atualizado
0952-8091	International Journal of Computer Applications in Technology	B3	CIÊNCIA DA COMPUTAÇÃO	Atualizado
1841-9836	International Journal of Computers, Communications & Control (Print)	B3	CIÊNCIA DA COMPUTAÇÃO	Atualizado
1548-3924	International Journal of Data Warehousing and Mining	B3	CIÊNCIA DA COMPUTAÇÃO	Atualizado
1539-3100	International Journal of Distance Education Technologies	B3	CIÊNCIA DA COMPUTAÇÃO	Atualizado
1550-1477	International Journal of Distributed Sensor Networks (Online)	B3	CIÊNCIA DA COMPUTAÇÃO	Atualizado
1548-1131	International Journal of e-Business Research	B3	CIÊNCIA DA COMPUTAÇÃO	Atualizado
1548-3886	International Journal of Electronic Government Research	B3	CIÊNCIA DA COMPUTAÇÃO	Atualizado
1472-8915	International Journal of Engineering Intelligent Systems for Electrical Engineering and Communications (1997)	B3	CIÊNCIA DA COMPUTAÇÃO	Atualizado
1740-0562	International Journal of High Performance Computing and Networking (Print)	B3	CIÊNCIA DA COMPUTAÇÃO	Atualizado
1448-5869	International Journal of Hybrid Intelligent Systems	B3	CIÊNCIA DA COMPUTAÇÃO	Atualizado
1550-1876	International Journal of Information and Communication Technology Education	B3	CIÊNCIA DA COMPUTAÇÃO	Atualizado
1368-2148	International Journal of Manufacturing Technology and Management	B3	CIÊNCIA DA COMPUTAÇÃO	Atualizado
1744-2621	International Journal of Metadata, Semantics and Ontologies (Print)	B3	CIÊNCIA DA COMPUTAÇÃO	Atualizado
1470-9503	International Journal of Networking and Virtual Organisations	B3	CIÊNCIA DA COMPUTAÇÃO	Atualizado
1099-1190	International Journal of Network Management (Online)	B3	CIÊNCIA DA COMPUTAÇÃO	Atualizado
1055-7148	International Journal of Network Management (Print)	B3	CIÊNCIA DA COMPUTAÇÃO	Atualizado
1745-7645	International Journal of Operational Research (Print)	B3	CIÊNCIA DA COMPUTAÇÃO	Atualizado
1110-662X	International Journal of Photoenergy (Print)	B3	CIÊNCIA DA COMPUTAÇÃO	Atualizado
0020-7608	International Journal of Quantum Chemistry	B3	CIÊNCIA DA COMPUTAÇÃO	Atualizado
1477-8394	International Journal of Web Based Communities (Print)	B3	CIÊNCIA DA COMPUTAÇÃO	Atualizado
1744-0084	International Journal of Web Information Systems (Print)	B3	CIÊNCIA DA COMPUTAÇÃO	Atualizado
0218-2130	International Journal on Artificial Intelligence Tools	B3	CIÊNCIA DA COMPUTAÇÃO	Atualizado
1432-5012	International Journal on Digital Libraries (Print)	B3	CIÊNCIA DA COMPUTAÇÃO	Atualizado
1984-2902	iSys: Revista Brasileira de Sistemas de Informação	B3	CIÊNCIA DA COMPUTAÇÃO	Atualizado
1433-8157	Journal for Geometry and Graphics	B3	CIÊNCIA DA COMPUTAÇÃO	Atualizado
0197-6729	Journal of Advanced Transportation	B3	CIÊNCIA DA COMPUTAÇÃO	Atualizado
0021-8693	Journal of Algebra (Print)	B3	CIÊNCIA DA COMPUTAÇÃO	Atualizado
1570-8683	Journal of Applied Logic	B3	CIÊNCIA DA COMPUTAÇÃO	Atualizado
1054-3406	Journal of Biopharmaceutical Statistics (Print)	B3	CIÊNCIA DA COMPUTAÇÃO	Atualizado
0749-0208	Journal of Coastal Research	B3	CIÊNCIA DA COMPUTAÇÃO	Atualizado
1569-8025	Journal of Computational Electronics (Print)	B3	CIÊNCIA DA COMPUTAÇÃO	Atualizado
1549-3636	Journal of Computer Sciences	B3	CIÊNCIA DA COMPUTAÇÃO	Atualizado
1064-2307	Journal of Computer & Systems Sciences International	B3	CIÊNCIA DA COMPUTAÇÃO	Atualizado
1570-8667	Journal of Discrete Algorithms (Print)	B3	CIÊNCIA DA COMPUTAÇÃO	Atualizado
1740-4460	Journal of Embedded Computing	B3	CIÊNCIA DA COMPUTAÇÃO	Atualizado
0926-6801	Journal of High Speed Networks	B3	CIÊNCIA DA COMPUTAÇÃO	Atualizado
1465-1734	Journal of Hydroinformatics (Online)	B3	CIÊNCIA DA COMPUTAÇÃO	Atualizado
2178-7107	Journal of Information and Data Management - JIDM	B3	CIÊNCIA DA COMPUTAÇÃO	Atualizado
1554-1010	Journal of Information Assurance and Security	B3	CIÊNCIA DA COMPUTAÇÃO	Atualizado
1072-3374	Journal of Mathematical Sciences (New York, N.Y.)	B3	CIÊNCIA DA COMPUTAÇÃO	Atualizado
1559-3959	Journal of Mechanics of Materials and Structures	B3	CIÊNCIA DA COMPUTAÇÃO	Atualizado
1609-0985	Journal of Medical and Biological Engineering	B3	CIÊNCIA DA COMPUTAÇÃO	Atualizado
1516-7399	Journal of Microwaves and Optoelectronics	B3	CIÊNCIA DA COMPUTAÇÃO	Atualizado
1542-3980	Journal of Multiple-Valued Logic and Soft Computing	B3	CIÊNCIA DA COMPUTAÇÃO	Atualizado
1064-7570	Journal of Network and Systems Management	B3	CIÊNCIA DA COMPUTAÇÃO	Atualizado
0929-8215	Journal of New Music Research	B3	CIÊNCIA DA COMPUTAÇÃO	Atualizado
1048-5252	Journal of Nonparametric Statistics (Print)	B3	CIÊNCIA DA COMPUTAÇÃO	Atualizado
0022-3611	Journal of Philosophical Logic	B3	CIÊNCIA DA COMPUTAÇÃO	Atualizado
1443-458X	Journal of Research and Practice in Information Technology	B3	CIÊNCIA DA COMPUTAÇÃO	Atualizado
1303-2968	Journal of Sports Science and Medicine	B3	CIÊNCIA DA COMPUTAÇÃO	Atualizado
0920-8542	Journal of Supercomputing	B3	CIÊNCIA DA COMPUTAÇÃO	Atualizado
0103-5053	Journal of the Brazilian Chemical Society (Impresso)	B3	CIÊNCIA DA COMPUTAÇÃO	Atualizado
0970-1249	Journal of the Ramanujan Mathematical Society	B3	CIÊNCIA DA COMPUTAÇÃO	Atualizado
1875-8975	Journal of Visualization (Online)	B3	CIÊNCIA DA COMPUTAÇÃO	Atualizado
1540-9589	Journal of Web Engineering	B3	CIÊNCIA DA COMPUTAÇÃO	Atualizado
1861-2032	Journal on Data Semantics (Print)	B3	CIÊNCIA DA COMPUTAÇÃO	Atualizado
1574-020X	Language Resources and Evaluation	B3	CIÊNCIA DA COMPUTAÇÃO	Atualizado
1380-7870	Lifetime Data Analysis	B3	CIÊNCIA DA COMPUTAÇÃO	Atualizado
1661-8297	Logica Universalis (Print)	B3	CIÊNCIA DA COMPUTAÇÃO	Atualizado
1368-9894	Logic Journal of the IGPL (Online)	B3	CIÊNCIA DA COMPUTAÇÃO	Atualizado
1367-0751	Logic Journal of the IGPL (Print)	B3	CIÊNCIA DA COMPUTAÇÃO	Atualizado
1022-1344	Macromolecular Theory and Simulations	B3	CIÊNCIA DA COMPUTAÇÃO	Atualizado
1387-3954	Mathematical and Computer Modelling of Dynamical Systems	B3	CIÊNCIA DA COMPUTAÇÃO	Atualizado
1024-123X	Mathematical Problems in Engineering (Print)	B3	CIÊNCIA DA COMPUTAÇÃO	Atualizado
1867-2949	Mathematical Programming Computation	B3	CIÊNCIA DA COMPUTAÇÃO	Atualizado
1134-5632	Mathware & Soft Computing	B3	CIÊNCIA DA COMPUTAÇÃO	Atualizado
0932-4194	MCSS. Mathematics of Control, Signals and Systems	B3	CIÊNCIA DA COMPUTAÇÃO	Atualizado
1573-4064	Medicinal Chemistry (Hilversum)	B3	CIÊNCIA DA COMPUTAÇÃO	Atualizado
0882-4010	Microbial Pathogenesis	B3	CIÊNCIA DA COMPUTAÇÃO	Atualizado
1572-8641	Minds and Machines	B3	CIÊNCIA DA COMPUTAÇÃO	Atualizado
1567-7818	Natural Computing	B3	CIÊNCIA DA COMPUTAÇÃO	Atualizado
1210-0552	Neural Network World (Prague)	B3	CIÊNCIA DA COMPUTAÇÃO	Atualizado
1361-4568	New Review of Hypermedia and Multimedia	B3	CIÊNCIA DA COMPUTAÇÃO	Atualizado
1092-0277	North American Actuarial Journal	B3	CIÊNCIA DA COMPUTAÇÃO	Atualizado
1793-7191	Open Systems and Information Dynamics	B3	CIÊNCIA DA COMPUTAÇÃO	Atualizado
1349-8169	Pacific journal of optimization (Online)	B3	CIÊNCIA DA COMPUTAÇÃO	Atualizado
1348-9151	Pacific Journal of Optimization (Print)	B3	CIÊNCIA DA COMPUTAÇÃO	Atualizado
1054-6618	Pattern Recognition and Image Analysis	B3	CIÊNCIA DA COMPUTAÇÃO	Atualizado
0101-7438	Pesquisa Operacional (Impresso)	B3	CIÊNCIA DA COMPUTAÇÃO	Atualizado
0100-736X	Pesquisa Veterinária Brasileira (Impresso)	B3	CIÊNCIA DA COMPUTAÇÃO	Atualizado
0033-0337	Program (London. 1966)	B3	CIÊNCIA DA COMPUTAÇÃO	Atualizado
1608-3261	Programming and Computer Software (Online)	B3	CIÊNCIA DA COMPUTAÇÃO	Atualizado
1477-5956	Proteome Science	B3	CIÊNCIA DA COMPUTAÇÃO	Atualizado
1469-7688	Quantitative Finance (Print)	B3	CIÊNCIA DA COMPUTAÇÃO	Atualizado
0399-0559	RAIRO. Recherche Opérationnelle	B3	CIÊNCIA DA COMPUTAÇÃO	Atualizado
